{
  "schemaVersion": "1.1",
  "scenarioSlug": "equipment-maintenance",
  "status": "READY_FOR_APPROVAL",
  "eligibleForHumanApproval": true,
  "executionAuthorized": false,
  "evidenceTrust": "recorded-test",
  "verifiedForHumanReview": false,
  "evaluatedAtUtc": "2026-10-19T12:00:00.0000000+00:00",
  "decisionId": "sha256:4a09be3e70f4c085253f6feab4a2f5045f47fc41ffdc9472fd44d169fab8fd1c",
  "planId": "sha256:a1a6a61a74a961339e5fe3fa577aa3c0361ccd69bc91b4a7708e1efa8e638008",
  "planSha256": "2bbd2e9701d207a8c6868d3172709c4eaece9fe4bd3db5072afb381b99816b8b",
  "decisionSha256": "91bb37d0071246f0cd99cce3993a9c02bec2c267953891d3ef363cd51ba297e4",
  "evidenceSha256": "ecda54c0c9221b1617410969256ec33acbed474fded1671090914ceb295e9999",
  "scopeSha256": "2d31ae8d809c5a6d4658daef1dadc17972c49346a3ab3638398e3775efcabb0f",
  "environment": {
    "environmentId": "11111111-1111-4111-8111-111111111111",
    "tenantId": "22222222-2222-4222-8222-222222222222",
    "url": "https://synthetic.example.test"
  },
  "authorizedOperationCategories": [],
  "findings": [],
  "blockedOperations": [],
  "dependencyOrder": [
    "FAST006-CREATE-B3B249C06BA9"
  ],
  "packageDependencyOrder": [],
  "componentOwnership": [
    {
      "taskId": "FAST006-CREATE-B3B249C06BA9",
      "componentKind": "table",
      "componentIdentity": "tst_record",
      "action": "CREATE",
      "ownership": "solution-owned",
      "managed": false,
      "directModificationAllowed": false,
      "evidence": [
        {
          "taskId": "FAST006-CREATE-B3B249C06BA9",
          "componentKind": "table",
          "componentIdentity": "tst_record",
          "exists": false,
          "ownership": "solution-owned",
          "managed": false,
          "customizable": false,
          "allowedActions": [
            "CREATE"
          ]
        }
      ]
    }
  ],
  "securityRequirements": [
    {
      "taskId": "FAST006-CREATE-B3B249C06BA9",
      "permission": "customize",
      "principalId": "33333333-3333-4333-8333-333333333333",
      "satisfied": true
    },
    {
      "taskId": "FAST006-CREATE-B3B249C06BA9",
      "permission": "read-metadata",
      "principalId": "33333333-3333-4333-8333-333333333333",
      "satisfied": true
    },
    {
      "taskId": "FAST006-CREATE-B3B249C06BA9",
      "permission": "write-solution",
      "principalId": "33333333-3333-4333-8333-333333333333",
      "satisfied": true
    }
  ],
  "acceptanceTraceability": [
    {
      "requirementId": "REQ-001",
      "taskIds": [
        "FAST006-CREATE-B3B249C06BA9"
      ],
      "acceptanceCriteria": [
        "Users can complete the primary task."
      ],
      "decisionId": "sha256:4a09be3e70f4c085253f6feab4a2f5045f47fc41ffdc9472fd44d169fab8fd1c"
    }
  ]
}
