{
  "schemaVersion": "1.0",
  "scenarioSlug": "library-circulation",
  "status": "READY_FOR_APPROVAL",
  "eligibleForHumanApproval": true,
  "executionAuthorized": false,
  "evaluatedAtUtc": "2026-10-19T12:00:00.0000000+00:00",
  "decisionId": "sha256:25285de37f941532b0f7781a2eb69d716584940ace0e7c89b6618eb4c0320d70",
  "planId": "sha256:d1702d1e39ba91af8830904880939f297d5b171c65391e3873db8fa55c554d95",
  "planSha256": "cb7fa12fb589ba54048515fdc0b97af1206e6a9fc3e20ce410ed341d9f03f511",
  "decisionSha256": "9378bbaf87043ad0c01e5c429a35cfcc9469a9535b3f22840e3810324acb8101",
  "evidenceSha256": "d287b2ee0189bac54cca5a5922eb29bdf906d73d6d2ea662f2ccbbcef7b3bd91",
  "scopeSha256": "dced51408f5100035daeccf036bd53e9f9207e550bf49cdcc2745538b4c8cc24",
  "environment": {
    "environmentId": "11111111-1111-4111-8111-111111111111",
    "tenantId": "22222222-2222-4222-8222-222222222222",
    "url": "https://synthetic.example.test"
  },
  "authorizedOperationCategories": [],
  "findings": [],
  "blockedOperations": [],
  "dependencyOrder": [
    "FAST006-CREATE-E6ED656839ED",
    "FAST006-CREATE-24BAC22E1EDD",
    "FAST006-CREATE-82EA781ACFC6",
    "FAST006-CREATE-B9CD3CC28AAE"
  ],
  "packageDependencyOrder": [
    "synthetic_records"
  ],
  "componentOwnership": [
    {
      "taskId": "FAST006-CREATE-24BAC22E1EDD",
      "componentKind": "form",
      "componentIdentity": "tst_record:starter-form",
      "action": "REUSE",
      "ownership": "accelerator-managed",
      "managed": true,
      "directModificationAllowed": false,
      "evidence": [
        {
          "taskId": "FAST006-CREATE-24BAC22E1EDD",
          "componentKind": "form",
          "componentIdentity": "tst_record:starter-form",
          "exists": true,
          "ownership": "accelerator-managed",
          "managed": true,
          "customizable": true,
          "allowedActions": [
            "CREATE",
            "REUSE",
            "EXTEND",
            "INTEGRATE"
          ]
        }
      ]
    },
    {
      "taskId": "FAST006-CREATE-82EA781ACFC6",
      "componentKind": "application",
      "componentIdentity": "library-circulation:model-driven-app",
      "action": "CREATE",
      "ownership": "solution-owned",
      "managed": false,
      "directModificationAllowed": false,
      "evidence": [
        {
          "taskId": "FAST006-CREATE-82EA781ACFC6",
          "componentKind": "application",
          "componentIdentity": "library-circulation:model-driven-app",
          "exists": false,
          "ownership": "solution-owned",
          "managed": false,
          "customizable": true,
          "allowedActions": [
            "CREATE",
            "REUSE",
            "EXTEND",
            "INTEGRATE"
          ]
        }
      ]
    },
    {
      "taskId": "FAST006-CREATE-B9CD3CC28AAE",
      "componentKind": "view",
      "componentIdentity": "tst_record:starter-view",
      "action": "CREATE",
      "ownership": "solution-owned",
      "managed": false,
      "directModificationAllowed": false,
      "evidence": [
        {
          "taskId": "FAST006-CREATE-B9CD3CC28AAE",
          "componentKind": "view",
          "componentIdentity": "tst_record:starter-view",
          "exists": false,
          "ownership": "solution-owned",
          "managed": false,
          "customizable": true,
          "allowedActions": [
            "CREATE",
            "REUSE",
            "EXTEND",
            "INTEGRATE"
          ]
        }
      ]
    },
    {
      "taskId": "FAST006-CREATE-E6ED656839ED",
      "componentKind": "table",
      "componentIdentity": "tst_record",
      "action": "CREATE",
      "ownership": "solution-owned",
      "managed": false,
      "directModificationAllowed": false,
      "evidence": [
        {
          "taskId": "FAST006-CREATE-E6ED656839ED",
          "componentKind": "table",
          "componentIdentity": "tst_record",
          "exists": false,
          "ownership": "solution-owned",
          "managed": false,
          "customizable": true,
          "allowedActions": [
            "CREATE",
            "REUSE",
            "EXTEND",
            "INTEGRATE"
          ]
        }
      ]
    }
  ],
  "securityRequirements": [
    {
      "taskId": "FAST006-CREATE-24BAC22E1EDD",
      "permission": "read-metadata",
      "principalId": "33333333-3333-4333-8333-333333333333",
      "satisfied": true
    },
    {
      "taskId": "FAST006-CREATE-82EA781ACFC6",
      "permission": "customize",
      "principalId": "33333333-3333-4333-8333-333333333333",
      "satisfied": true
    },
    {
      "taskId": "FAST006-CREATE-82EA781ACFC6",
      "permission": "read-metadata",
      "principalId": "33333333-3333-4333-8333-333333333333",
      "satisfied": true
    },
    {
      "taskId": "FAST006-CREATE-82EA781ACFC6",
      "permission": "write-solution",
      "principalId": "33333333-3333-4333-8333-333333333333",
      "satisfied": true
    },
    {
      "taskId": "FAST006-CREATE-B9CD3CC28AAE",
      "permission": "customize",
      "principalId": "33333333-3333-4333-8333-333333333333",
      "satisfied": true
    },
    {
      "taskId": "FAST006-CREATE-B9CD3CC28AAE",
      "permission": "read-metadata",
      "principalId": "33333333-3333-4333-8333-333333333333",
      "satisfied": true
    },
    {
      "taskId": "FAST006-CREATE-B9CD3CC28AAE",
      "permission": "write-solution",
      "principalId": "33333333-3333-4333-8333-333333333333",
      "satisfied": true
    },
    {
      "taskId": "FAST006-CREATE-E6ED656839ED",
      "permission": "customize",
      "principalId": "33333333-3333-4333-8333-333333333333",
      "satisfied": true
    },
    {
      "taskId": "FAST006-CREATE-E6ED656839ED",
      "permission": "read-metadata",
      "principalId": "33333333-3333-4333-8333-333333333333",
      "satisfied": true
    },
    {
      "taskId": "FAST006-CREATE-E6ED656839ED",
      "permission": "write-solution",
      "principalId": "33333333-3333-4333-8333-333333333333",
      "satisfied": true
    }
  ],
  "acceptanceTraceability": [
    {
      "requirementId": "REQ-001",
      "taskIds": [
        "FAST006-CREATE-24BAC22E1EDD",
        "FAST006-CREATE-82EA781ACFC6",
        "FAST006-CREATE-B9CD3CC28AAE",
        "FAST006-CREATE-E6ED656839ED"
      ],
      "acceptanceCriteria": [
        "Users can complete the primary task."
      ],
      "decisionId": "sha256:25285de37f941532b0f7781a2eb69d716584940ace0e7c89b6618eb4c0320d70"
    }
  ]
}
