{
  "schemaVersion": "1.0",
  "scenarioSlug": "event-registration",
  "status": "READY_FOR_APPROVAL",
  "eligibleForHumanApproval": true,
  "executionAuthorized": false,
  "evaluatedAtUtc": "2026-10-19T12:00:00.0000000+00:00",
  "decisionId": "sha256:8ef195df73d1494c53d024ade3c3105150b2283a34e3e391775c71f2ee748767",
  "planId": "sha256:fc1c750eac36fc489b56220e9247c6c351398627ea6bfc175d0907389df9781c",
  "planSha256": "a6d70aac35fa077717e9222550b8eabfc0f573426a74cf918d14b17946deb7d0",
  "decisionSha256": "14e8308d063d6d2179aa6f897e501d1ed150c7fb48decdf8646488558d2de1c2",
  "evidenceSha256": "da760dd8a608e1256d8e871f72d8db1d19cc19f5a35cf02c9f03ecd7bd6792c0",
  "scopeSha256": "819318aeece0d00230156a38da69aae36a0f58ac8b74c4ad13b592c06f69ca44",
  "environment": {
    "environmentId": "11111111-1111-4111-8111-111111111111",
    "tenantId": "22222222-2222-4222-8222-222222222222",
    "url": "https://synthetic.example.test"
  },
  "authorizedOperationCategories": [],
  "findings": [],
  "blockedOperations": [],
  "dependencyOrder": [
    "FAST006-CREATE-E6ED656839ED",
    "FAST006-CREATE-24BAC22E1EDD",
    "FAST006-CREATE-B9CD3CC28AAE",
    "FAST006-CREATE-EAE9E365A683"
  ],
  "packageDependencyOrder": [],
  "componentOwnership": [
    {
      "taskId": "FAST006-CREATE-24BAC22E1EDD",
      "componentKind": "form",
      "componentIdentity": "tst_record:starter-form",
      "action": "CREATE",
      "ownership": "solution-owned",
      "managed": false,
      "directModificationAllowed": false,
      "evidence": [
        {
          "taskId": "FAST006-CREATE-24BAC22E1EDD",
          "componentKind": "form",
          "componentIdentity": "tst_record:starter-form",
          "exists": false,
          "ownership": "solution-owned",
          "managed": false,
          "customizable": true,
          "allowedActions": [
            "CREATE",
            "REUSE",
            "EXTEND",
            "INTEGRATE"
          ]
        }
      ]
    },
    {
      "taskId": "FAST006-CREATE-B9CD3CC28AAE",
      "componentKind": "view",
      "componentIdentity": "tst_record:starter-view",
      "action": "CREATE",
      "ownership": "solution-owned",
      "managed": false,
      "directModificationAllowed": false,
      "evidence": [
        {
          "taskId": "FAST006-CREATE-B9CD3CC28AAE",
          "componentKind": "view",
          "componentIdentity": "tst_record:starter-view",
          "exists": false,
          "ownership": "solution-owned",
          "managed": false,
          "customizable": true,
          "allowedActions": [
            "CREATE",
            "REUSE",
            "EXTEND",
            "INTEGRATE"
          ]
        }
      ]
    },
    {
      "taskId": "FAST006-CREATE-E6ED656839ED",
      "componentKind": "table",
      "componentIdentity": "tst_record",
      "action": "CREATE",
      "ownership": "solution-owned",
      "managed": false,
      "directModificationAllowed": false,
      "evidence": [
        {
          "taskId": "FAST006-CREATE-E6ED656839ED",
          "componentKind": "table",
          "componentIdentity": "tst_record",
          "exists": false,
          "ownership": "solution-owned",
          "managed": false,
          "customizable": true,
          "allowedActions": [
            "CREATE",
            "REUSE",
            "EXTEND",
            "INTEGRATE"
          ]
        }
      ]
    },
    {
      "taskId": "FAST006-CREATE-EAE9E365A683",
      "componentKind": "application",
      "componentIdentity": "event-registration:model-driven-app",
      "action": "CREATE",
      "ownership": "solution-owned",
      "managed": false,
      "directModificationAllowed": false,
      "evidence": [
        {
          "taskId": "FAST006-CREATE-EAE9E365A683",
          "componentKind": "application",
          "componentIdentity": "event-registration:model-driven-app",
          "exists": false,
          "ownership": "solution-owned",
          "managed": false,
          "customizable": true,
          "allowedActions": [
            "CREATE",
            "REUSE",
            "EXTEND",
            "INTEGRATE"
          ]
        }
      ]
    }
  ],
  "securityRequirements": [
    {
      "taskId": "FAST006-CREATE-24BAC22E1EDD",
      "permission": "customize",
      "principalId": "33333333-3333-4333-8333-333333333333",
      "satisfied": true
    },
    {
      "taskId": "FAST006-CREATE-24BAC22E1EDD",
      "permission": "read-metadata",
      "principalId": "33333333-3333-4333-8333-333333333333",
      "satisfied": true
    },
    {
      "taskId": "FAST006-CREATE-24BAC22E1EDD",
      "permission": "write-solution",
      "principalId": "33333333-3333-4333-8333-333333333333",
      "satisfied": true
    },
    {
      "taskId": "FAST006-CREATE-B9CD3CC28AAE",
      "permission": "customize",
      "principalId": "33333333-3333-4333-8333-333333333333",
      "satisfied": true
    },
    {
      "taskId": "FAST006-CREATE-B9CD3CC28AAE",
      "permission": "read-metadata",
      "principalId": "33333333-3333-4333-8333-333333333333",
      "satisfied": true
    },
    {
      "taskId": "FAST006-CREATE-B9CD3CC28AAE",
      "permission": "write-solution",
      "principalId": "33333333-3333-4333-8333-333333333333",
      "satisfied": true
    },
    {
      "taskId": "FAST006-CREATE-E6ED656839ED",
      "permission": "customize",
      "principalId": "33333333-3333-4333-8333-333333333333",
      "satisfied": true
    },
    {
      "taskId": "FAST006-CREATE-E6ED656839ED",
      "permission": "read-metadata",
      "principalId": "33333333-3333-4333-8333-333333333333",
      "satisfied": true
    },
    {
      "taskId": "FAST006-CREATE-E6ED656839ED",
      "permission": "write-solution",
      "principalId": "33333333-3333-4333-8333-333333333333",
      "satisfied": true
    },
    {
      "taskId": "FAST006-CREATE-EAE9E365A683",
      "permission": "customize",
      "principalId": "33333333-3333-4333-8333-333333333333",
      "satisfied": true
    },
    {
      "taskId": "FAST006-CREATE-EAE9E365A683",
      "permission": "read-metadata",
      "principalId": "33333333-3333-4333-8333-333333333333",
      "satisfied": true
    },
    {
      "taskId": "FAST006-CREATE-EAE9E365A683",
      "permission": "write-solution",
      "principalId": "33333333-3333-4333-8333-333333333333",
      "satisfied": true
    }
  ],
  "acceptanceTraceability": [
    {
      "requirementId": "REQ-001",
      "taskIds": [
        "FAST006-CREATE-24BAC22E1EDD",
        "FAST006-CREATE-B9CD3CC28AAE",
        "FAST006-CREATE-E6ED656839ED",
        "FAST006-CREATE-EAE9E365A683"
      ],
      "acceptanceCriteria": [
        "Users can complete the primary task."
      ],
      "decisionId": "sha256:8ef195df73d1494c53d024ade3c3105150b2283a34e3e391775c71f2ee748767"
    }
  ]
}
