{
  "schemaVersion": "1.1",
  "scenarioSlug": "missing-accelerator",
  "status": "BLOCKED_COMPATIBILITY",
  "eligibleForHumanApproval": false,
  "executionAuthorized": false,
  "evidenceTrust": "recorded-test",
  "verifiedForHumanReview": false,
  "evaluatedAtUtc": "2026-10-19T12:00:00.0000000+00:00",
  "decisionId": "sha256:a1ce35f9a2044e9af46813d2aa190b6cb1102f4696d9c5004bfa83a33232bf87",
  "planId": "sha256:b326c49dda9c42eef8debaff28e53e4073c503eaf91734bb854374f3f28d07f1",
  "planSha256": "00b9c2aa618f790b9eeaf79ba9aa289e1aba502471abfee765a4598794dfda7a",
  "decisionSha256": "a286513b3d61f281809606833c0411cd2f00a23dc4e5185f054acbd4c26b2332",
  "evidenceSha256": "0fe68bc6b3f9bbf2c8ead7972e31fe8e5dc00ab2537124035a03106696daa6f1",
  "scopeSha256": "d1cbd70e5c14b6aadc790b9481abdbe3512d72b743e39b2e7f585ada2fbfe553",
  "environment": {
    "environmentId": "11111111-1111-4111-8111-111111111111",
    "tenantId": "22222222-2222-4222-8222-222222222222",
    "url": "https://synthetic.example.test"
  },
  "authorizedOperationCategories": [],
  "findings": [
    {
      "status": "BLOCKED_COMPATIBILITY",
      "code": "OWNERSHIP_CONFLICT",
      "taskId": "FAST006-REUSE-345219E8B4EB",
      "message": "Ownership or component identity conflicts for 'tst_record'.",
      "remediation": "Resolve actual component ownership without recreating managed components."
    },
    {
      "status": "BLOCKED_COMPATIBILITY",
      "code": "VERIFICATION_component-owner",
      "taskId": "",
      "message": "Ownership requires exact solution-component membership and publisher metadata; prefix alone is not ownership proof.",
      "remediation": "Resolve the verified prerequisite or restriction and collect fresh evidence."
    },
    {
      "status": "BLOCKED_PREREQUISITES",
      "code": "SOLUTION_NOT_INSTALLED",
      "taskId": "",
      "message": "Required solution 'synthetic_records' is not installed.",
      "remediation": "Arrange separately authorized prerequisite provisioning; preflight installs nothing."
    },
    {
      "status": "BLOCKED_PREREQUISITES",
      "code": "VERIFICATION_installed-solution",
      "taskId": "",
      "message": "The required solution must be installed exactly once.",
      "remediation": "Resolve the verified prerequisite or restriction and collect fresh evidence."
    }
  ],
  "blockedOperations": [
    "FAST006-REUSE-345219E8B4EB"
  ],
  "dependencyOrder": [
    "FAST006-REUSE-345219E8B4EB"
  ],
  "packageDependencyOrder": [
    "synthetic_records"
  ],
  "componentOwnership": [
    {
      "taskId": "FAST006-REUSE-345219E8B4EB",
      "componentKind": "table",
      "componentIdentity": "tst_record",
      "action": "REUSE",
      "ownership": "accelerator-managed",
      "managed": true,
      "directModificationAllowed": false,
      "evidence": [
        {
          "taskId": "FAST006-REUSE-345219E8B4EB",
          "componentKind": "table",
          "componentIdentity": "tst_record",
          "exists": true,
          "ownership": "unresolved",
          "managed": true,
          "customizable": true,
          "allowedActions": [
            "REUSE"
          ]
        }
      ]
    }
  ],
  "securityRequirements": [
    {
      "taskId": "FAST006-REUSE-345219E8B4EB",
      "permission": "read-metadata",
      "principalId": "33333333-3333-4333-8333-333333333333",
      "satisfied": true
    }
  ],
  "acceptanceTraceability": [
    {
      "requirementId": "REQ-001",
      "taskIds": [
        "FAST006-REUSE-345219E8B4EB"
      ],
      "acceptanceCriteria": [
        "Users can complete the primary task."
      ],
      "decisionId": "sha256:a1ce35f9a2044e9af46813d2aa190b6cb1102f4696d9c5004bfa83a33232bf87"
    }
  ]
}
