{
  "schemaVersion": "1.0",
  "scenarioSlug": "missing-prerequisites",
  "status": "BLOCKED_PREREQUISITES",
  "eligibleForHumanApproval": false,
  "executionAuthorized": false,
  "evaluatedAtUtc": "2026-10-19T12:00:00.0000000+00:00",
  "decisionId": "sha256:bef171546d823197bcdc63771bd782097c709be1490c32c13455032762890eea",
  "planId": "sha256:58f936a87cdb39556bf0fe72cf9e29c196de54b94fe348af9dd7fe611cd1113c",
  "planSha256": "a5b8a14b7833238bb3f69f34987034e621a2058660d2037a19fc20dee17555b1",
  "decisionSha256": "3b675aae59053a69f05520292d911e2cd78a5e0ac789f673276f28874a5a5ced",
  "evidenceSha256": "bcb15801056bf444a2f9f21231e03c8397fdae6417293721875512c4c16d8418",
  "scopeSha256": "971c95b84cbaf02430e93e5dddb8288ab62ffe6d3143b5523ba9dc958d80d096",
  "environment": {
    "environmentId": "11111111-1111-4111-8111-111111111111",
    "tenantId": "22222222-2222-4222-8222-222222222222",
    "url": "https://synthetic.example.test"
  },
  "authorizedOperationCategories": [],
  "findings": [
    {
      "status": "BLOCKED_PREREQUISITES",
      "code": "SOLUTION_NOT_INSTALLED",
      "taskId": "",
      "message": "Required solution 'synthetic_records' is not installed.",
      "remediation": "Arrange separately authorized prerequisite provisioning; preflight installs nothing."
    }
  ],
  "blockedOperations": [
    "FAST006-CREATE-1EE3E11255E9",
    "FAST006-CREATE-24BAC22E1EDD",
    "FAST006-CREATE-B9CD3CC28AAE",
    "FAST006-CREATE-E6ED656839ED"
  ],
  "dependencyOrder": [
    "FAST006-CREATE-E6ED656839ED",
    "FAST006-CREATE-1EE3E11255E9",
    "FAST006-CREATE-24BAC22E1EDD",
    "FAST006-CREATE-B9CD3CC28AAE"
  ],
  "packageDependencyOrder": [
    "synthetic_records"
  ],
  "componentOwnership": [
    {
      "taskId": "FAST006-CREATE-1EE3E11255E9",
      "componentKind": "application",
      "componentIdentity": "missing-prerequisites:model-driven-app",
      "action": "REUSE",
      "ownership": "accelerator-managed",
      "managed": true,
      "directModificationAllowed": false,
      "evidence": [
        {
          "taskId": "FAST006-CREATE-1EE3E11255E9",
          "componentKind": "application",
          "componentIdentity": "missing-prerequisites:model-driven-app",
          "exists": true,
          "ownership": "accelerator-managed",
          "managed": true,
          "customizable": true,
          "allowedActions": [
            "CREATE",
            "REUSE",
            "EXTEND",
            "INTEGRATE"
          ]
        }
      ]
    },
    {
      "taskId": "FAST006-CREATE-24BAC22E1EDD",
      "componentKind": "form",
      "componentIdentity": "tst_record:starter-form",
      "action": "CREATE",
      "ownership": "solution-owned",
      "managed": false,
      "directModificationAllowed": false,
      "evidence": [
        {
          "taskId": "FAST006-CREATE-24BAC22E1EDD",
          "componentKind": "form",
          "componentIdentity": "tst_record:starter-form",
          "exists": false,
          "ownership": "solution-owned",
          "managed": false,
          "customizable": true,
          "allowedActions": [
            "CREATE",
            "REUSE",
            "EXTEND",
            "INTEGRATE"
          ]
        }
      ]
    },
    {
      "taskId": "FAST006-CREATE-B9CD3CC28AAE",
      "componentKind": "view",
      "componentIdentity": "tst_record:starter-view",
      "action": "CREATE",
      "ownership": "solution-owned",
      "managed": false,
      "directModificationAllowed": false,
      "evidence": [
        {
          "taskId": "FAST006-CREATE-B9CD3CC28AAE",
          "componentKind": "view",
          "componentIdentity": "tst_record:starter-view",
          "exists": false,
          "ownership": "solution-owned",
          "managed": false,
          "customizable": true,
          "allowedActions": [
            "CREATE",
            "REUSE",
            "EXTEND",
            "INTEGRATE"
          ]
        }
      ]
    },
    {
      "taskId": "FAST006-CREATE-E6ED656839ED",
      "componentKind": "table",
      "componentIdentity": "tst_record",
      "action": "CREATE",
      "ownership": "solution-owned",
      "managed": false,
      "directModificationAllowed": false,
      "evidence": [
        {
          "taskId": "FAST006-CREATE-E6ED656839ED",
          "componentKind": "table",
          "componentIdentity": "tst_record",
          "exists": false,
          "ownership": "solution-owned",
          "managed": false,
          "customizable": true,
          "allowedActions": [
            "CREATE",
            "REUSE",
            "EXTEND",
            "INTEGRATE"
          ]
        }
      ]
    }
  ],
  "securityRequirements": [
    {
      "taskId": "FAST006-CREATE-1EE3E11255E9",
      "permission": "read-metadata",
      "principalId": "33333333-3333-4333-8333-333333333333",
      "satisfied": true
    },
    {
      "taskId": "FAST006-CREATE-24BAC22E1EDD",
      "permission": "customize",
      "principalId": "33333333-3333-4333-8333-333333333333",
      "satisfied": true
    },
    {
      "taskId": "FAST006-CREATE-24BAC22E1EDD",
      "permission": "read-metadata",
      "principalId": "33333333-3333-4333-8333-333333333333",
      "satisfied": true
    },
    {
      "taskId": "FAST006-CREATE-24BAC22E1EDD",
      "permission": "write-solution",
      "principalId": "33333333-3333-4333-8333-333333333333",
      "satisfied": true
    },
    {
      "taskId": "FAST006-CREATE-B9CD3CC28AAE",
      "permission": "customize",
      "principalId": "33333333-3333-4333-8333-333333333333",
      "satisfied": true
    },
    {
      "taskId": "FAST006-CREATE-B9CD3CC28AAE",
      "permission": "read-metadata",
      "principalId": "33333333-3333-4333-8333-333333333333",
      "satisfied": true
    },
    {
      "taskId": "FAST006-CREATE-B9CD3CC28AAE",
      "permission": "write-solution",
      "principalId": "33333333-3333-4333-8333-333333333333",
      "satisfied": true
    },
    {
      "taskId": "FAST006-CREATE-E6ED656839ED",
      "permission": "customize",
      "principalId": "33333333-3333-4333-8333-333333333333",
      "satisfied": true
    },
    {
      "taskId": "FAST006-CREATE-E6ED656839ED",
      "permission": "read-metadata",
      "principalId": "33333333-3333-4333-8333-333333333333",
      "satisfied": true
    },
    {
      "taskId": "FAST006-CREATE-E6ED656839ED",
      "permission": "write-solution",
      "principalId": "33333333-3333-4333-8333-333333333333",
      "satisfied": true
    }
  ],
  "acceptanceTraceability": [
    {
      "requirementId": "REQ-001",
      "taskIds": [
        "FAST006-CREATE-1EE3E11255E9",
        "FAST006-CREATE-24BAC22E1EDD",
        "FAST006-CREATE-B9CD3CC28AAE",
        "FAST006-CREATE-E6ED656839ED"
      ],
      "acceptanceCriteria": [
        "Users can complete the primary task."
      ],
      "decisionId": "sha256:bef171546d823197bcdc63771bd782097c709be1490c32c13455032762890eea"
    }
  ]
}
