{
  "schemaVersion": "1.1",
  "scenarioSlug": "missing-permissions",
  "status": "BLOCKED_SECURITY",
  "eligibleForHumanApproval": false,
  "executionAuthorized": false,
  "evidenceTrust": "recorded-test",
  "verifiedForHumanReview": false,
  "evaluatedAtUtc": "2026-10-19T12:00:00.0000000+00:00",
  "decisionId": "sha256:5c6dc47c7f0fa6a74c5ccd055cc9edeab379a1a08f1574f57c2f44358cbc6519",
  "planId": "sha256:2fc8c5959e56e09374f0f25c87b1d56f061663c5ea1e07b3f6a79d7ac2c8e22e",
  "planSha256": "5fbe209e8fa179c0b0388bc2e4722dde5e669b985e07ec9441a38c758ccbc860",
  "decisionSha256": "1a4f4252488424a73254b8f67d3d98bf5a6a09bf79063172024fa3db7c320d7f",
  "evidenceSha256": "0f9f512c3107c46ab880c42b974c6121fd52b0ae4725ea4014e0e015496e8088",
  "scopeSha256": "32c6ae2ad3846bc79ea9337605bd0d9409f0940f4e9734101ca82af5a4e9bacb",
  "environment": {
    "environmentId": "11111111-1111-4111-8111-111111111111",
    "tenantId": "22222222-2222-4222-8222-222222222222",
    "url": "https://synthetic.example.test"
  },
  "authorizedOperationCategories": [],
  "findings": [
    {
      "status": "BLOCKED_SECURITY",
      "code": "PERMISSION_MISSING",
      "taskId": "FAST006-CREATE-726FF028B339",
      "message": "Principal lacks 'customize' for 'FAST006-CREATE-726FF028B339'.",
      "remediation": "Have an authorized administrator verify the required scoped permission; preflight grants nothing."
    },
    {
      "status": "BLOCKED_SECURITY",
      "code": "VERIFICATION_privilege",
      "taskId": "",
      "message": "The authenticated principal requires the named effective Global privilege; successful reads do not imply write permissions.",
      "remediation": "Resolve the verified prerequisite or restriction and collect fresh evidence."
    }
  ],
  "blockedOperations": [
    "FAST006-CREATE-726FF028B339"
  ],
  "dependencyOrder": [
    "FAST006-CREATE-726FF028B339"
  ],
  "packageDependencyOrder": [],
  "componentOwnership": [
    {
      "taskId": "FAST006-CREATE-726FF028B339",
      "componentKind": "table",
      "componentIdentity": "tst_record",
      "action": "CREATE",
      "ownership": "solution-owned",
      "managed": false,
      "directModificationAllowed": false,
      "evidence": [
        {
          "taskId": "FAST006-CREATE-726FF028B339",
          "componentKind": "table",
          "componentIdentity": "tst_record",
          "exists": false,
          "ownership": "solution-owned",
          "managed": false,
          "customizable": false,
          "allowedActions": [
            "CREATE"
          ]
        }
      ]
    }
  ],
  "securityRequirements": [
    {
      "taskId": "FAST006-CREATE-726FF028B339",
      "permission": "customize",
      "principalId": "33333333-3333-4333-8333-333333333333",
      "satisfied": false
    },
    {
      "taskId": "FAST006-CREATE-726FF028B339",
      "permission": "read-metadata",
      "principalId": "33333333-3333-4333-8333-333333333333",
      "satisfied": true
    },
    {
      "taskId": "FAST006-CREATE-726FF028B339",
      "permission": "write-solution",
      "principalId": "33333333-3333-4333-8333-333333333333",
      "satisfied": true
    }
  ],
  "acceptanceTraceability": [
    {
      "requirementId": "REQ-001",
      "taskIds": [
        "FAST006-CREATE-726FF028B339"
      ],
      "acceptanceCriteria": [
        "Users can complete the primary task."
      ],
      "decisionId": "sha256:5c6dc47c7f0fa6a74c5ccd055cc9edeab379a1a08f1574f57c2f44358cbc6519"
    }
  ]
}
