{
  "schemaVersion": "1.0",
  "scenarioSlug": "changed-package",
  "status": "BLOCKED_DECISION_CHANGE",
  "eligibleForHumanApproval": false,
  "executionAuthorized": false,
  "evaluatedAtUtc": "2026-10-19T12:00:00.0000000+00:00",
  "decisionId": "sha256:7977602a86d0645c591de30c9501251b9076e24ac6284c9207bc5c8584ce9334",
  "planId": "sha256:d7b3e8bcaca55123923640077bb9300f59432d886e6c01fabffc0d79a888466e",
  "planSha256": "ef06f2f6755a6bb28786f84afdb126f407e9d3f3d9877d03b9dcdcd97cbcf5bf",
  "decisionSha256": "dcc9d5e73702aa8b4050f0a6368ae0882235265576cb5e1553a9d111a6c52744",
  "evidenceSha256": "4cdbe7fb79e787eb6a061de4e835dc9abb6b6f099e1560f55257815a33769218",
  "scopeSha256": "50badf1856b2122bbcb2ec690d82cd6975de37cb02a4d3b8e5cef906c5fe5994",
  "environment": {
    "environmentId": "11111111-1111-4111-8111-111111111111",
    "tenantId": "22222222-2222-4222-8222-222222222222",
    "url": "https://synthetic.example.test"
  },
  "authorizedOperationCategories": [],
  "findings": [
    {
      "status": "BLOCKED_DECISION_CHANGE",
      "code": "PACKAGE_IDENTITY",
      "taskId": "",
      "message": "Package identity/version/hash changed for 'synthetic-records'.",
      "remediation": "Reapprove changed package identities and recollect evidence."
    }
  ],
  "blockedOperations": [
    "FAST006-CREATE-24BAC22E1EDD",
    "FAST006-CREATE-B9CD3CC28AAE",
    "FAST006-CREATE-C03333A1B490",
    "FAST006-CREATE-E6ED656839ED"
  ],
  "dependencyOrder": [
    "FAST006-CREATE-E6ED656839ED",
    "FAST006-CREATE-24BAC22E1EDD",
    "FAST006-CREATE-B9CD3CC28AAE",
    "FAST006-CREATE-C03333A1B490"
  ],
  "packageDependencyOrder": [
    "synthetic_records"
  ],
  "componentOwnership": [
    {
      "taskId": "FAST006-CREATE-24BAC22E1EDD",
      "componentKind": "form",
      "componentIdentity": "tst_record:starter-form",
      "action": "REUSE",
      "ownership": "accelerator-managed",
      "managed": true,
      "directModificationAllowed": false,
      "evidence": [
        {
          "taskId": "FAST006-CREATE-24BAC22E1EDD",
          "componentKind": "form",
          "componentIdentity": "tst_record:starter-form",
          "exists": true,
          "ownership": "accelerator-managed",
          "managed": true,
          "customizable": true,
          "allowedActions": [
            "CREATE",
            "REUSE",
            "EXTEND",
            "INTEGRATE"
          ]
        }
      ]
    },
    {
      "taskId": "FAST006-CREATE-B9CD3CC28AAE",
      "componentKind": "view",
      "componentIdentity": "tst_record:starter-view",
      "action": "CREATE",
      "ownership": "solution-owned",
      "managed": false,
      "directModificationAllowed": false,
      "evidence": [
        {
          "taskId": "FAST006-CREATE-B9CD3CC28AAE",
          "componentKind": "view",
          "componentIdentity": "tst_record:starter-view",
          "exists": false,
          "ownership": "solution-owned",
          "managed": false,
          "customizable": true,
          "allowedActions": [
            "CREATE",
            "REUSE",
            "EXTEND",
            "INTEGRATE"
          ]
        }
      ]
    },
    {
      "taskId": "FAST006-CREATE-C03333A1B490",
      "componentKind": "application",
      "componentIdentity": "changed-package:model-driven-app",
      "action": "CREATE",
      "ownership": "solution-owned",
      "managed": false,
      "directModificationAllowed": false,
      "evidence": [
        {
          "taskId": "FAST006-CREATE-C03333A1B490",
          "componentKind": "application",
          "componentIdentity": "changed-package:model-driven-app",
          "exists": false,
          "ownership": "solution-owned",
          "managed": false,
          "customizable": true,
          "allowedActions": [
            "CREATE",
            "REUSE",
            "EXTEND",
            "INTEGRATE"
          ]
        }
      ]
    },
    {
      "taskId": "FAST006-CREATE-E6ED656839ED",
      "componentKind": "table",
      "componentIdentity": "tst_record",
      "action": "CREATE",
      "ownership": "solution-owned",
      "managed": false,
      "directModificationAllowed": false,
      "evidence": [
        {
          "taskId": "FAST006-CREATE-E6ED656839ED",
          "componentKind": "table",
          "componentIdentity": "tst_record",
          "exists": false,
          "ownership": "solution-owned",
          "managed": false,
          "customizable": true,
          "allowedActions": [
            "CREATE",
            "REUSE",
            "EXTEND",
            "INTEGRATE"
          ]
        }
      ]
    }
  ],
  "securityRequirements": [
    {
      "taskId": "FAST006-CREATE-24BAC22E1EDD",
      "permission": "read-metadata",
      "principalId": "33333333-3333-4333-8333-333333333333",
      "satisfied": true
    },
    {
      "taskId": "FAST006-CREATE-B9CD3CC28AAE",
      "permission": "customize",
      "principalId": "33333333-3333-4333-8333-333333333333",
      "satisfied": true
    },
    {
      "taskId": "FAST006-CREATE-B9CD3CC28AAE",
      "permission": "read-metadata",
      "principalId": "33333333-3333-4333-8333-333333333333",
      "satisfied": true
    },
    {
      "taskId": "FAST006-CREATE-B9CD3CC28AAE",
      "permission": "write-solution",
      "principalId": "33333333-3333-4333-8333-333333333333",
      "satisfied": true
    },
    {
      "taskId": "FAST006-CREATE-C03333A1B490",
      "permission": "customize",
      "principalId": "33333333-3333-4333-8333-333333333333",
      "satisfied": true
    },
    {
      "taskId": "FAST006-CREATE-C03333A1B490",
      "permission": "read-metadata",
      "principalId": "33333333-3333-4333-8333-333333333333",
      "satisfied": true
    },
    {
      "taskId": "FAST006-CREATE-C03333A1B490",
      "permission": "write-solution",
      "principalId": "33333333-3333-4333-8333-333333333333",
      "satisfied": true
    },
    {
      "taskId": "FAST006-CREATE-E6ED656839ED",
      "permission": "customize",
      "principalId": "33333333-3333-4333-8333-333333333333",
      "satisfied": true
    },
    {
      "taskId": "FAST006-CREATE-E6ED656839ED",
      "permission": "read-metadata",
      "principalId": "33333333-3333-4333-8333-333333333333",
      "satisfied": true
    },
    {
      "taskId": "FAST006-CREATE-E6ED656839ED",
      "permission": "write-solution",
      "principalId": "33333333-3333-4333-8333-333333333333",
      "satisfied": true
    }
  ],
  "acceptanceTraceability": [
    {
      "requirementId": "REQ-001",
      "taskIds": [
        "FAST006-CREATE-24BAC22E1EDD",
        "FAST006-CREATE-B9CD3CC28AAE",
        "FAST006-CREATE-C03333A1B490",
        "FAST006-CREATE-E6ED656839ED"
      ],
      "acceptanceCriteria": [
        "Users can complete the primary task."
      ],
      "decisionId": "sha256:7977602a86d0645c591de30c9501251b9076e24ac6284c9207bc5c8584ce9334"
    }
  ]
}
